Case	Topic	Notes
Communist Party of the United States v. Subversive Activities Control Bd. No. 12 367 u.s. 1 (1961)	Freedom of Association	
Scales v. United States 367 u.s. 203 (1961)	Freedom of Association	
National Association for the Advancement of Colored People v. Button 371 u.s. 415 (1963)	Freedom of Association	
Edwards v. South Carolina 372 u.s. 229 (1963)	Freedom of Association	
Aptheker v. Secretary of State 378 u.s. 500 (1964)	Freedom of Association	
Cox v. Louisiana 379 u.s. 536 (1965)	Freedom of Association	
Evans v. Newton 382 u.s. 296 (1966)	Freedom of Association	
Keyishian v. Board of Regents 385 u.s. 589 (1967)	Freedom of Association	
Moose Lodge No. 107 v. Irvis 407 u.s. 163 (1972)	Freedom of Association	
Communist Party of Indiana v. Whitcomb 414 u.s. 441 (1974)	Freedom of Association	
Buckley v. Valeo 424 u.s. 1 (1976)	Freedom of Association	
Moore v. City of East Cleveland 431 u.s. 494 (1977)	Freedom of Association	
Nixon v. Administrator of General Services 433 u.s. 425 (1977)	Freedom of Association	
McDaniel v. Paty 435 u.s. 618 (1978)	Freedom of Association	
In re Primus 436 u.s. 412 (1978)	Freedom of Association	
National Association for the Advancement of Colored People v. Claiborne Hardware Co. 458 u.s. 886 (1982)	Freedom of Association	
Hishon v. King & Spalding 467 u.s. 69 (1984)	Freedom of Association	
Roberts v. United States Jaycees 468 u.s. 609 (1984)	Freedom of Association	
Bowers v. Hardwick 478 u.s. 186 (1986)	Freedom of Association	
"Board of Directors, Rotary International v. Rotary Club of Duarte 481 u.s. 537 (1987)"	Freedom of Association	
Board of Education of Westside Community Schools v. Mergens By and Through Mergens 496 u.s. 226 (1990)	Freedom of Association	
Rutan v. Republican Party of Illinois 497 u.s. 62 (1990)	Freedom of Association	
Dawson v. Delaware 503 u.s. 159 (1992)	Freedom of Association	
California Democratic Party v. Jones 530 u.s. 567 (2000)	Freedom of Association	
Boy Scouts of America v. Dale 530 u.s. 640 (2000)	Freedom of Association	
Selective Draft Law Cases 245 u.s. 366 (1918)	Freedom of Religion	
Pierce v. Society of Sisters 268 u.s. 510 (1925)	Freedom of Religion	
Cantwell v. Connecticut 310 u.s. 296 (1940)	Freedom of Religion	
Minersville School District v. Board of Education 310 u.s. 586 (1940)	Freedom of Religion	
West Virginia State Board of Education v. Barnette 319 u.s. 624 (1943)	Freedom of Religion	
Prince v. Massachusetts 321 u.s. 158 (1944)	Freedom of Religion	
Marsh v. Alabama 326 u.s. 501 (1946)	Freedom of Religion	
Everson v. Board of Education of the Township of Ewing 330 u.s. 1 (1947)	Freedom of Religion	
Illinois ex rel. McCollum v. Board of Education of School District 333 u.s. 203 (1948)	Freedom of Religion	
Zorach v. Clauson 343 u.s. 306 (1952)	Freedom of Religion	
"Joseph Burstyn, Inc. v. Wilson 343 u.s. 495 (1952)"	Freedom of Religion	
Engel v. Vitale 370 u.s. 421 (1962)	Freedom of Religion	
"School District of Abington Township, Pennsylvania v. Schempp 374 u.s. 203 (1963)"	Freedom of Religion	
Sherbert v. Verner 374 u.s. 398 (1963)	Freedom of Religion	
Board of Education v. Allen 392 u.s. 236 (1968)	Freedom of Religion	
Epperson v. Arkansas 393 u.s. 97 (1968)	Freedom of Religion	
Welsh v. United States 398 u.s. 333 (1970)	Freedom of Religion	
Lemon v. Kurtzman 403 u.s. 602 (1971)	Freedom of Religion	
Wisconsin v. Yoder 406 u.s. 205 (1972)	Freedom of Religion	
Johnson v. Robison 415 u.s. 361 (1974)	Freedom of Religion	
McDaniel v. Paty 435 u.s. 618 (1978)	Freedom of Religion	
Harris v. McRae 448 u.s. 297 (1980)	Freedom of Religion	
Stone v. Graham 449 u.s. 39 (1980)	Freedom of Religion	
Thomas v. Review Board of the Indiana Employment Security Division 450 u.s. 707 (1981)	Freedom of Religion	
Heffron v. International Soc'y for Krishna Consciousness 452 u.s. 640 (1981)	Freedom of Religion	
Widmar v. Vincent 454 u.s. 263 (1981)	Freedom of Religion	
"Valley Forge Christian College v. Americans United for Separation of Church and State, Inc. 454 u.s. 464 (1982)"	Freedom of Religion	
Bob Jones Univ. v. United States 461 u.s. 574 (1983)	Freedom of Religion	
Mueller v. Allen 463 u.s. 388 (1983)	Freedom of Religion	
Marsh v. Chambers 463 u.s. 783 (1983)	Freedom of Religion	
Lynch v. Donnelly 465 u.s. 668 (1984)	Freedom of Religion	
Wallace v. Jaffree 472 u.s. 38 (1985)	Freedom of Religion	
"Estate of Thornton v. Caldor, Inc. 472 u.s. 703 (1985)"	Freedom of Religion	
School District v. Ball 473 u.s. 373 (1985)	Freedom of Religion	
Aguilar v. Felton 473 u.s. 402 (1985)	Freedom of Religion	
Goldman v. Weinberger 475 u.s. 503 (1986)	Freedom of Religion	
Bowen v. Roy 476 u.s. 693 (1986)	Freedom of Religion	
Hobbie v. Unemployment Appeals Comm'n of Florida 480 u.s. 136 (1987)	Freedom of Religion	
Edwards v. Aguillard 482 u.s. 578 (1987)	Freedom of Religion	
Lyng v. Northwest Indian Cemetery Protective Association 485 u.s. 439 (1988)	Freedom of Religion	
Frazee v. Illinois Department of Employment Security 489 u.s. 829 (1989)	Freedom of Religion	
Webster v. Reproductive Health Services 492 u.s. 490 (1989)	Freedom of Religion	
"County of Allegheny v. American Civil Liberties Union, Greater Pittsburgh Chapter 492 u.s. 573 (1989)"	Freedom of Religion	
Employment Division v. Smith 494 u.s. 872 (1990)	Freedom of Religion	
Board of Education of Westside Community Schools v. Mergens By and Through Mergens 496 u.s. 226 (1990)	Freedom of Religion	
Lee v. Weisman 505 u.s. 577 (1992)	Freedom of Religion	
Lamb's Chapel v. Center Moriches Union Free School District 508 u.s. 384 (1993)	Freedom of Religion	
"Church of Lukumi Babalu Aye, Inc. v. City of Hialeah 508 u.s. 520 (1993)"	Freedom of Religion	
Rosenberger v. Rector & Visitors of the University of Virginia 515 u.s. 819 (1995)	Freedom of Religion	
Schenck v. United States 249 u.s. 47 (1919)	Freedom of Speech	
Abrams v. United States 250 u.s. 616 (1919)	Freedom of Speech	
Gitlow v. People 268 u.s. 652 (1925)	Freedom of Speech	
Whitney v. California 274 u.s. 357 (1927)	Freedom of Speech	
Stromberg v. California 283 u.s. 359 (1931)	Freedom of Speech	
Near v. Minnesota 283 u.s. 697 (1931)	Freedom of Speech	
"Grosjean v. American Press Co., Inc. 297 u.s. 233 (1936)"	Freedom of Speech	
De Jonge v. Oregon 299 u.s. 353 (1937)	Freedom of Speech	
Hague v. Committee for Industrial Organization 307 u.s. 496 (1939)	Freedom of Speech	
Thornhill v. Alabama 310 u.s. 88 (1940)	Freedom of Speech	
Cantwell v. Connecticut 310 u.s. 296 (1940)	Freedom of Speech	
Chaplinsky v. New Hampshire 315 u.s. 568 (1942)	Freedom of Speech	
Marsh v. Alabama 326 u.s. 501 (1946)	Freedom of Speech	
American Communications Assn. v. Douds 339 u.s. 382 (1950)	Freedom of Speech	
Dennis v. United States 341 u.s. 494 (1951)	Freedom of Speech	
Adler v. Board of Education of City of New York 342 u.s. 485 (1952)	Freedom of Speech	
"Joseph Burstyn, Inc. v. Wilson 343 u.s. 495 (1952)"	Freedom of Speech	
Watkins v. United States 354 u.s. 178 (1957)	Freedom of Speech	
Yates v. United States 354 u.s. 298 (1957)	Freedom of Speech	
Roth v. United States 354 u.s. 476 (1957)	Freedom of Speech	
Barenblatt v. United States 360 u.s. 109 (1959)	Freedom of Speech	
Communist Party of the United States v. Subversive Activities Control Bd. No. 12 367 u.s. 1 (1961)	Freedom of Speech	
Scales v. United States 367 u.s. 203 (1961)	Freedom of Speech	
National Association for the Advancement of Colored People v. Button 371 u.s. 415 (1963)	Freedom of Speech	
Edwards v. South Carolina 372 u.s. 229 (1963)	Freedom of Speech	
New York Times Co. v. Sullivan 376 u.s. 254 (1964)	Freedom of Speech	
Jacobellis v. Ohio 378 u.s. 184 (1964)	Freedom of Speech	
Aptheker v. Secretary of State 378 u.s. 500 (1964)	Freedom of Speech	
Cox v. Louisiana 379 u.s. 536 (1965)	Freedom of Speech	
Cox v. Louisiana 379 u.s. 559 (1965)	Freedom of Speech	
Zemel v. Rusk 381 u.s. 1 (1965)	Freedom of Speech	
"A Book Named ""John Cleland's Memoirs of a Woman of Pleasure"" v. Attorney General of Massachusetts 383 u.s. 413 (1966)"	Freedom of Speech	
Bond v. Floyd 385 u.s. 116 (1966)	Freedom of Speech	
Keyishian v. Board of Regents 385 u.s. 589 (1967)	Freedom of Speech	
Curtis Publishing Co. v. Butts 388 u.s. 130 (1967)	Freedom of Speech	
"Amalgamated Food Employees Union Local 590 v. Logan Valley Plaza, Inc. 391 u.s. 308 (1968)"	Freedom of Speech	
United States v. O'Brien 391 u.s. 367 (1968)	Freedom of Speech	
Epperson v. Arkansas 393 u.s. 97 (1968)	Freedom of Speech	
Tinker v. Des Moines Independent Community School Dist. 393 u.s. 503 (1969)	Freedom of Speech	
Stanley v. Georgia 394 u.s. 557 (1969)	Freedom of Speech	
Street v. New York 394 u.s. 576 (1969)	Freedom of Speech	
Brandenburg v. Ohio 395 u.s. 444 (1969)	Freedom of Speech	
Rowan v. United States Post Office Department 397 u.s. 728 (1970)	Freedom of Speech	
Younger v. Harris 401 u.s. 37 (1971)	Freedom of Speech	
Cohen v. California 403 u.s. 15 (1971)	Freedom of Speech	
Rosenbloom v. Metromedia 403 u.s. 29 (1971)	Freedom of Speech	
New York Times Co. v. United States 403 u.s. 713 (1971)	Freedom of Speech	
"Lloyd Corp., Ltd. v. Tanner 407 u.s. 551 (1972)"	Freedom of Speech	
Police Dep't v. Mosley 408 u.s. 92 (1972)	Freedom of Speech	
Grayned v. City of Rockford 408 u.s. 104 (1972)	Freedom of Speech	
Perry v. Sindermann 408 u.s. 593 (1972)	Freedom of Speech	
Branzburg v. Hayes 408 u.s. 665 (1972)	Freedom of Speech	
Miller v. California 413 u.s. 15 (1973)	Freedom of Speech	
Pittsburgh Press Co. v. Pittsburgh Commission on Human Relations 413 u.s. 376 (1973)	Freedom of Speech	
Smith v. Goguen 415 u.s. 566 (1974)	Freedom of Speech	
Jenkins v. Georgia 418 u.s. 153 (1974)	Freedom of Speech	
Miami Herald Publishing Co. v. Tornillo 418 u.s. 241 (1974)	Freedom of Speech	
Lehman v. City of Shaker Heights 418 u.s. 298 (1974)	Freedom of Speech	
"Gertz v. Robert Welch, Inc. 418 u.s. 323 (1974)"	Freedom of Speech	
Spence v. Washington 418 u.s. 405 (1974)	Freedom of Speech	
Bigelow v. Virginia 421 u.s. 809 (1975)	Freedom of Speech	
Buckley v. Valeo 424 u.s. 1 (1976)	Freedom of Speech	
"Time, Inc. v. Firestone 424 u.s. 448 (1976)"	Freedom of Speech	
Hudgens v. National Labor Relations Board 424 u.s. 507 (1976)	Freedom of Speech	
Greer v. Spock 424 u.s. 828 (1976)	Freedom of Speech	
"Virginia State Board of Pharmacy v. Virginia Citizens Consumer Council, Inc. 425 u.s. 748 (1976)"	Freedom of Speech	
"Young v. American Mini Theatres, Inc. 427 u.s. 50 (1976)"	Freedom of Speech	
Wooley v. Maynard 430 u.s. 705 (1977)	Freedom of Speech	
"Linmark Associates, Inc. v. Township of Willingboro 431 u.s. 85 (1977)"	Freedom of Speech	
Carey v. Population Services International 431 u.s. 678 (1977)	Freedom of Speech	
Bates v. State Bar of Arizona 433 u.s. 350 (1977)	Freedom of Speech	
In re Primus 436 u.s. 412 (1978)	Freedom of Speech	
Hutchinson v. Proxmire 443 u.s. 111 (1979)	Freedom of Speech	
"Gannett Co., Inc. v. DePasquale 443 u.s. 368 (1979)"	Freedom of Speech	
Pruneyard Shopping Center v. Robins 447 u.s. 74 (1980)	Freedom of Speech	
Central Hudson Gas & Elec. Corp. v. Public Service Comm'n 447 u.s. 557 (1980)	Freedom of Speech	
"Richmond Newspapers, Inc. v. Virginia 448 u.s. 555 (1980)"	Freedom of Speech	
Schad v. Borough of Mount Ephraim 452 u.s. 61 (1981)	Freedom of Speech	
Heffron v. International Soc'y for Krishna Consciousness 452 u.s. 640 (1981)	Freedom of Speech	
"Metromedia, Inc. v. City of San Diego 453 u.s. 490 (1981)"	Freedom of Speech	
Widmar v. Vincent 454 u.s. 263 (1981)	Freedom of Speech	
Brown v. Hartlage 456 u.s. 45 (1982)	Freedom of Speech	
Globe Newspaper Co. v. Superior Court 457 u.s. 596 (1982)	Freedom of Speech	
Board of Educ. v. Pico 457 u.s. 853 (1982)	Freedom of Speech	
New York v. Ferber 458 u.s. 747 (1982)	Freedom of Speech	
National Association for the Advancement of Colored People v. Claiborne Hardware Co. 458 u.s. 886 (1982)	Freedom of Speech	
Connick v. Myers 461 u.s. 138 (1983)	Freedom of Speech	
Bolger v. Youngs Drugs Prods. Corp. 463 u.s. 60 (1983)	Freedom of Speech	
Members of the City Council of the City of Los Angeles v. Taxpayers for Vincent 466 u.s. 789 (1984)	Freedom of Speech	
Clark v. Community for Creative Nonviolence 468 u.s. 288 (1984)	Freedom of Speech	
Cornelius v. NAACP Legal Defense & Educ. Fund 473 u.s. 788 (1985)	Freedom of Speech	
"City of Renton v. Playtime Theatres, Inc. 475 u.s. 41 (1986)"	Freedom of Speech	
Press-Enterprise Co. v. Superior Court 478 u.s. 1 (1986)	Freedom of Speech	
Bethel School Dist. No. 403 v. Fraser 478 u.s. 675 (1986)	Freedom of Speech	
"Board of Airport Commissioners of the City of Los Angeles v. Jews for Jesus, Inc. 482 u.s. 569 (1987)"	Freedom of Speech	
Rankin v. McPherson 483 u.s. 378 (1987)	Freedom of Speech	
Hazelwood School Dist. v. Kuhlmeier 484 u.s. 260 (1988)	Freedom of Speech	
"Hustler Magazine, Inc. v. Falwell 485 u.s. 46 (1988)"	Freedom of Speech	
Boos v. Barry 485 u.s. 312 (1988)	Freedom of Speech	
Frisby v. Schultz 487 u.s. 474 (1988)	Freedom of Speech	
Texas v. Johnson 491 u.s. 397 (1989)	Freedom of Speech	
Massachusetts v. Oakes 491 u.s. 576 (1989)	Freedom of Speech	
Ward v. Rock Against Racism 491 u.s. 781 (1989)	Freedom of Speech	
Osborne v. Ohio 495 u.s. 103 (1990)	Freedom of Speech	
Board of Education of Westside Community Schools v. Mergens By and Through Mergens 496 u.s. 226 (1990)	Freedom of Speech	
United States v. Eichman 496 u.s. 310 (1990)	Freedom of Speech	
Milkovich v. Lorain Journal Co. 497 u.s. 1 (1990)	Freedom of Speech	
Rutan v. Republican Party of Illinois 497 u.s. 62 (1990)	Freedom of Speech	
Rust v. Sullivan 500 u.s. 173 (1991)	Freedom of Speech	
"Barnes v. Glen Theatre, Inc. 501 u.s. 560 (1991)"	Freedom of Speech	
Dawson v. Delaware 503 u.s. 159 (1992)	Freedom of Speech	
R.A.V. v. City of St. Paul 505 u.s. 377 (1992)	Freedom of Speech	
"International Society for Krishna Consciousness, Inc. v. Lee 505 u.s. 672 (1992)"	Freedom of Speech	
Lamb's Chapel v. Center Moriches Union Free School District 508 u.s. 384 (1993)	Freedom of Speech	
Rosenberger v. Rector & Visitors of the University of Virginia 515 u.s. 819 (1995)	Freedom of Speech	
Ashcroft v. Free Speech Coalition 00-795 (2002)	Freedom of Speech	
Republican Party of Minnesota v. White 01-521 (2002)	Freedom of Speech	
Schenck v. United States 249 u.s. 47 (1919)	Freedom of the Press	
Abrams v. United States 250 u.s. 616 (1919)	Freedom of the Press	
Gitlow v. People 268 u.s. 652 (1925)	Freedom of the Press	
Near v. Minnesota 283 u.s. 697 (1931)	Freedom of the Press	
"Grosjean v. American Press Co., Inc. 297 u.s. 233 (1936)"	Freedom of the Press	
Thornhill v. Alabama 310 u.s. 88 (1940)	Freedom of the Press	
Marsh v. Alabama 326 u.s. 501 (1946)	Freedom of the Press	
"Joseph Burstyn, Inc. v. Wilson 343 u.s. 495 (1952)"	Freedom of the Press	
Yates v. United States 354 u.s. 298 (1957)	Freedom of the Press	
New York Times Co. v. Sullivan 376 u.s. 254 (1964)	Freedom of the Press	
Aptheker v. Secretary of State 378 u.s. 500 (1964)	Freedom of the Press	
Curtis Publishing Co. v. Butts 388 u.s. 130 (1967)	Freedom of the Press	
Brandenburg v. Ohio 395 u.s. 444 (1969)	Freedom of the Press	
Rosenbloom v. Metromedia 403 u.s. 29 (1971)	Freedom of the Press	
New York Times Co. v. United States 403 u.s. 713 (1971)	Freedom of the Press	
Branzburg v. Hayes 408 u.s. 665 (1972)	Freedom of the Press	
Pittsburgh Press Co. v. Pittsburgh Commission on Human Relations 413 u.s. 376 (1973)	Freedom of the Press	
Communist Party of Indiana v. Whitcomb 414 u.s. 441 (1974)	Freedom of the Press	
Miami Herald Publishing Co. v. Tornillo 418 u.s. 241 (1974)	Freedom of the Press	
"Gertz v. Robert Welch, Inc. 418 u.s. 323 (1974)"	Freedom of the Press	
Bigelow v. Virginia 421 u.s. 809 (1975)	Freedom of the Press	
"Time, Inc. v. Firestone 424 u.s. 448 (1976)"	Freedom of the Press	
Nebraska Press Assn. v. Stuart 427 u.s. 539 (1976)	Freedom of the Press	
Bates v. State Bar of Arizona 433 u.s. 350 (1977)	Freedom of the Press	
Zurcher v. Stanford Daily 436 u.s. 547 (1978)	Freedom of the Press	
"Richmond Newspapers, Inc. v. Virginia 448 u.s. 555 (1980)"	Freedom of the Press	
Chandler v. Florida 449 u.s. 560 (1981)	Freedom of the Press	
Globe Newspaper Co. v. Superior Court 457 u.s. 596 (1982)	Freedom of the Press	
Cohen v. Cowles Media Co. 501 u.s. 663 (1991)	Freedom of the Press	
Pennoyer v. Neff 95 u.s. 714 (1878)	Full Faith and Credit	
International Shoe v. State of Washington 326 u.s. 310 (1945)	Full Faith and Credit	
Minor v. Happersett 88 u.s. 162 (1875)	Gender	
Wengler v. Druggists Mutual Insurance Co. 446 u.s. 142 (1980)	Gender	
Rostker v. Goldberg 453 u.s. 57 (1981)	Gender	
Mississippi University for Women v. Hogan 458 u.s. 718 (1982)	Gender	
Arizona Governing Committee for Tax Deferred Annuity and Deferred Compensation Plans v. Norris 463 u.s. 1073 (1983)	Gender	
Hishon v. King & Spalding 467 u.s. 69 (1984)	Gender	
Roberts v. United States Jaycees 468 u.s. 609 (1984)	Gender	
Meritor Savings Bank v. Vinson 477 u.s. 57 (1986)	Gender	
"International Union, United Automobile, Aerospace & Agricultural Implement Workers of America, UAW v. Johnson Controls, Inc. 499 u.s. 187 (1991)"	Gender	
Clinton v. Jones 520 u.s. 681 (1997)	Gender	
"Oncale v. Sundowner Offshore Services, Inc. 523 u.s. 75 (1998)"	Gender	
"Burlington Industries, Inc. v. Ellerth 524 u.s. 742 (1998)"	Gender	
Faragher v. City of Boca Raton 524 u.s. 775 (1998)	Gender	
United States v. Morrison 529 u.s. 598 (2000)	Gender	
Hampton v. Mow Sun Wong 426 u.s. 88 (1976)	Government Employment	
National League of Cities v. Usery 426 u.s. 833 (1976)	Government Employment	
Dothard v. Rawlinson 433 u.s. 321 (1977)	Government Employment	
Cabell v. Chavez-Salido 454 u.s. 432 (1982)	Government Employment	
Nixon v. Fitzgerald 457 u.s. 731 (1982)	Government Employment	
Harlow v. Fitzgerald 457 u.s. 800 (1982)	Government Employment	
Wygant v. Jackson Board of Education 476 u.s. 267 (1986)	Government Employment	
United States v. Paradise 480 u.s. 149 (1987)	Government Employment	
Johnson v. Transportation Agency 480 u.s. 616 (1987)	Government Employment	
Rankin v. McPherson 483 u.s. 378 (1987)	Government Employment	
Martin v. Wilks 490 u.s. 755 (1989)	Government Employment	
Rutan v. Republican Party of Illinois 497 u.s. 62 (1990)	Government Employment	
Alden v. Maine 527 u.s. 706 (1999)	Government Employment	
Ableman v. Booth 62 u.s. 506 (1858)	Habeas Corpus	
Ex parte Milligan 71 u.s. 2 (1866)	Habeas Corpus	
Ex parte McCardle 74 u.s. 506 (1868)	Habeas Corpus	
Ex parte Siebold 100 u.s. 371 (1879)	Habeas Corpus	
In re Neagle 135 u.s. 1 (1890)	Habeas Corpus	
In re Debs 158 u.s. 564 (1895)	Habeas Corpus	
Johnson v. Zerbst 304 u.s. 458 (1938)	Habeas Corpus	
Betts v. Brady 316 u.s. 455 (1942)	Habeas Corpus	
Schneckloth v. Bustamonte 412 u.s. 218 (1973)	Habeas Corpus	
Smith v. Goguen 415 u.s. 566 (1974)	Habeas Corpus	
Murphy v. Florida 421 u.s. 794 (1975)	Habeas Corpus	
Brewer v. Williams 430 u.s. 387 (1977)	Habeas Corpus	
Pulley v. Harris 465 u.s. 37 (1984)	Habeas Corpus	
Ford v. Wainwright 477 u.s. 399 (1986)	Habeas Corpus	
Gomez v. United States District Court for the Northern District of California 503 u.s. 653 (1992)	Habeas Corpus	
Buck v. Bell 274 u.s. 200 (1927)	Handicapped	
Pennhurst State School and Hospital v. Halderman 451 u.s. 1 (1981)	Handicapped	
Sutton v. United Air Lines 527 u.s. 471 (1999)	Handicapped	
Buchanan v. Warley 245 u.s. 60 (1917)	Housing	
Block v. Hirsh 256 u.s. 135 (1921)	Housing	
Home Building & Loan Assn. v. Blaisdell 290 u.s. 398 (1934)	Housing	
Woods v. Cloyd W. Miller Co. 333 u.s. 138 (1948)	Housing	
Shelley v. Kraemer 334 u.s. 1 (1948)	Housing	
Berman v. Parker 348 u.s. 26 (1954)	Housing	
Warth v. Seldin 422 u.s. 490 (1975)	Housing	
Village of Arlington Heights v. Metropolitan 429 u.s. 252 (1977)	Housing	
Chisholm v. Georgia 2 u.s. 419 (1793)	Immunity	
Kilbourn v. Thompson 103 u.s. 168 (1880)	Immunity	
Pollock v. Farmers' Loan and Trust Company 157 u.s. 429 (1895)	Immunity	
Gravel v. United States 408 u.s. 606 (1972)	Immunity	
Doe v. McMillan 412 u.s. 306 (1973)	Immunity	
Butz v. Economou 438 u.s. 478 (1978)	Immunity	
Hutchinson v. Proxmire 443 u.s. 111 (1979)	Immunity	
Nixon v. Fitzgerald 457 u.s. 731 (1982)	Immunity	
Harlow v. Fitzgerald 457 u.s. 800 (1982)	Immunity	
Clinton v. Jones 520 u.s. 681 (1997)	Immunity	
Alden v. Maine 527 u.s. 706 (1999)	Immunity	
Seminole Tribe of Florida v. Florida 1995-41 (1996)	Immunity	
McCulloch v. Maryland 17 u.s. 316 (1819)	Implied Powers	
Head Money Cases 112 u.s. 580 (1884)	Import Tariffs	
Barron v. Mayor & City Council of Baltimore 32 u.s. 243 (1833)	Incorporation	
Hurtado v. California 110 u.s. 516 (1884)	Incorporation	
Gitlow v. People 268 u.s. 652 (1925)	Incorporation	
Cherokee Nation v. Georgia 30 u.s. 1 (1831)	Native Americans	
Worcester v. Georgia 31 u.s. 515 (1832)	Native Americans	
Williams v. Lee 358 u.s. 217 (1959)	Native Americans	
White Mountain Apache Tribe v. Bracker 448 u.s. 136 (1980)	Native Americans	
Bowen v. Roy 476 u.s. 693 (1986)	Native Americans	
Lyng v. Northwest Indian Cemetery Protective Association 485 u.s. 439 (1988)	Native Americans	
Employment Division v. Smith 494 u.s. 872 (1990)	Native Americans	
Seminole Tribe of Florida v. Florida 1995-41 (1996)	Native Americans	
Buck v. Bell 274 u.s. 200 (1927)	Insanity	
Powell v. Texas 392 u.s. 514 (1968)	Insanity	
Ford v. Wainwright 477 u.s. 399 (1986)	Insanity	
Penry v. Lynaugh 492 u.s. 302 (1989)	Insanity	
Scott v. Sandford 60 u.s. 393 (1856)	International Law	
Prize Cases 67 u.s. 635 (1862)	International Law	
United States v. Klein 80 u.s. 128 (1871)	International Law	
United States v. Wong Kim Ark 169 u.s. 649 (1898)	International Law	
Foster & Elam v. Neilson 27 u.s. 253 (1829)	International Relations	
Worcester v. Georgia 31 u.s. 515 (1832)	International Relations	
United States v. Libellants and Claimants of the Schooner Amistad 40 u.s. 518 (1841)	International Relations	
Prize Cases 67 u.s. 635 (1862)	International Relations	
Head Money Cases 112 u.s. 580 (1884)	International Relations	
State of Missouri v. Holland 252 u.s. 416 (1920)	International Relations	
United States v. Curtiss-Wright Export Corp. 299 u.s. 304 (1936)	International Relations	
United States v. Belmont 301 u.s. 324 (1937)	International Relations	
United States v. Pink 315 u.s. 203 (1942)	International Relations	
Reid v. Covert 354 u.s. 1 (1957)	International Relations	
Perez v. Brownell 356 u.s. 44 (1958)	International Relations	
Zemel v. Rusk 381 u.s. 1 (1965)	International Relations	
New York Times Co. v. United States 403 u.s. 713 (1971)	International Relations	
Boos v. Barry 485 u.s. 312 (1988)	International Relations	
Reno v. ACLU 521 u.s. 844 (1997)	Internet	
Kilbourn v. Thompson 103 u.s. 168 (1880)	Investigations	
Watkins v. United States 354 u.s. 178 (1957)	Investigations	
Barenblatt v. United States 360 u.s. 109 (1959)	Investigations	
Pollock v. Williams 322 u.s. 4 (1944)	Involuntary Servitude	
City of Memphis v. Greene 451 u.s. 100 (1981)	Involuntary Servitude	
Marbury v. Madison 5 u.s. 137 (1803)	Judicial Review	
Martin v. Hunter's Lessee 14 u.s. 304 (1816)	Judicial Review	
Cohens v. Virginia 19 u.s. 264 (1821)	Judicial Review	
South Carolina v. Katzenbach 383 u.s. 301 (1966)	Judicial Review	
Kent v. United States 383 u.s. 541 (1966)	Judicial Review	
Bond v. Floyd 385 u.s. 116 (1966)	Judicial Review	
Johnson v. Robison 415 u.s. 361 (1974)	Judicial Review	
United States v. Nixon 418 u.s. 683 (1974)	Judicial Review	
Warth v. Seldin 422 u.s. 490 (1975)	Judicial Review	
Mathews v. Eldridge 424 u.s. 319 (1976)	Judicial Review	
Minnesota v. Clover Leaf Creamery Co. 449 u.s. 456 (1981)	Judicial Review	
"Chevron U.S.A., Inc. v. Natural Resources Defense Council, Inc. 467 u.s. 837 (1984)"	Judicial Review	
Chisholm v. Georgia 2 u.s. 419 (1793)	Jurisdiction	
Georgia v. Brailsford 3 u.s. 1 (1794)	Jurisdiction	
Talbot v. Janson 3 u.s. 133 (1795)	Jurisdiction	
Calder v. Bull 3 u.s. 386 (1798)	Jurisdiction	
Marbury v. Madison 5 u.s. 137 (1803)	Jurisdiction	
United States v. Peters 9 u.s. 115 (1809)	Jurisdiction	
Willson v. Black Bird Creek Marsh Company 27 u.s. 245 (1829)	Jurisdiction	
Cherokee Nation v. Georgia 30 u.s. 1 (1831)	Jurisdiction	
Worcester v. Georgia 31 u.s. 515 (1832)	Jurisdiction	
Kendall v. United States 37 u.s. 524 (1838)	Jurisdiction	
Scott v. Sandford 60 u.s. 393 (1856)	Jurisdiction	
Ex parte Milligan 71 u.s. 2 (1866)	Jurisdiction	
Ex parte McCardle 74 u.s. 506 (1868)	Jurisdiction	
Texas v. White 74 u.s. 700 (1868)	Jurisdiction	
Pennoyer v. Neff 95 u.s. 714 (1878)	Jurisdiction	
Ex parte Siebold 100 u.s. 371 (1879)	Jurisdiction	
Pollock v. Farmers' Loan and Trust Company 157 u.s. 429 (1895)	Jurisdiction	
In re Debs 158 u.s. 564 (1895)	Jurisdiction	
Standard Oil Co. of New Jersey v. United States 221 u.s. 1 (1911)	Jurisdiction	
Pacific States Telephone and Telegraph Company v. Oregon 223 u.s. 118 (1912)	Jurisdiction	
State of Missouri v. Holland 252 u.s. 416 (1920)	Jurisdiction	
Tyson & Brother v. Banton 273 u.s. 418 (1927)	Jurisdiction	
Whitney v. California 274 u.s. 357 (1927)	Jurisdiction	
Olmstead v. United States 277 u.s. 438 (1928)	Jurisdiction	
Ex parte Bakelite Corporation 279 u.s. 438 (1929)	Jurisdiction	
"Nashville, Chattanooga & St. Louis Railway Co. v. Wallace 288 u.s. 249 (1933)"	Jurisdiction	
"Grosjean v. American Press Co., Inc. 297 u.s. 233 (1936)"	Jurisdiction	
United States v. Curtiss-Wright Export Corp. 299 u.s. 304 (1936)	Jurisdiction	
Hague v. Committee for Industrial Organization 307 u.s. 496 (1939)	Jurisdiction	
Ex Parte Quirin 317 u.s. 1 (1942)	Jurisdiction	
International Shoe v. State of Washington 326 u.s. 310 (1945)	Jurisdiction	
