Case	Topic	Notes
Roe v. Wade 410 u.s. 113 (1973)	Abortion	
Doe v. Bolton 410 u.s. 179 (1973)	Abortion	
Bigelow v. Virginia 421 u.s. 809 (1975)	Abortion	
Planned Parenthood of Central Missouri v. Danforth 428 u.s. 52 (1976)	Abortion	
Beal v. Doe 432 u.s. 438 (1977)	Abortion	
Maher v. Roe 432 u.s. 464 (1977)	Abortion	
Poelker v. Doe 432 u.s. 519 (1977)	Abortion	
Harris v. McRae 448 u.s. 297 (1980)	Abortion	
"Akron v. Akron Center for Reproductive Health, Inc. 462 u.s. 416 (1983)"	Abortion	
Thornburgh v. American College of Obstetricians & Gynecologists 476 u.s. 747 (1986)	Abortion	
Frisby v. Schultz 487 u.s. 474 (1988)	Abortion	
Webster v. Reproductive Health Services 492 u.s. 490 (1989)	Abortion	
Hodgson v. Minnesota 497 u.s. 417 (1990)	Abortion	
Rust v. Sullivan 500 u.s. 173 (1991)	Abortion	
Planned Parenthood of Southeastern Pennsylvania v. Casey 505 u.s. 833 (1992)	Abortion	
Regents of the Univ. of Cal. v. Bakke 438 u.s. 265 (1978)	Affirmative Action	
"United Steelworkers of America, AFL-CIO-CLC v. Weber 443 u.s. 193 (1979)"	Affirmative Action	
Fullilove v. Klutznick 448 u.s. 448 (1980)	Affirmative Action	
Mississippi University for Women v. Hogan 458 u.s. 718 (1982)	Affirmative Action	
Building Trades & Construction Trades Council of Camden County and Vicinity v. Mayor and Council of the City of Camden 465 u.s. 208 (1984)	Affirmative Action	
Firefighters Local Union No. 1784 v. Stotts 467 u.s. 561 (1984)	Affirmative Action	
Wygant v. Jackson Board of Education 476 u.s. 267 (1986)	Affirmative Action	
United States v. Paradise 480 u.s. 149 (1987)	Affirmative Action	
Johnson v. Transportation Agency 480 u.s. 616 (1987)	Affirmative Action	
City of Richmond v. J. A. Croson Co. 488 u.s. 469 (1989)	Affirmative Action	
"Metro Broadcasting, Inc. v. Federal Communications Commission 497 u.s. 547 (1990)"	Affirmative Action	
"Adarand Constructors, Inc. v. Pena 515 u.s. 200 (1995)"	Affirmative Action	
Truax v. Raich 239 u.s. 33 (1915)	Aliens	
United States v. Pink 315 u.s. 203 (1942)	Aliens	
Graham v. Department of Pub. Welfare 403 u.s. 365 (1971)	Aliens	
Hampton v. Mow Sun Wong 426 u.s. 88 (1976)	Aliens	
Ambach v. Norwick 441 u.s. 68 (1979)	Aliens	
Fullilove v. Klutznick 448 u.s. 448 (1980)	Aliens	
Cabell v. Chavez-Salido 454 u.s. 432 (1982)	Aliens	
Plyler v. Doe 457 u.s. 202 (1982)	Aliens	
INS v. Chadha 462 u.s. 919 (1983)	Aliens	
Welsh v. United States 398 u.s. 333 (1970)	Armed Services	
Johnson v. Robison 415 u.s. 361 (1974)	Armed Services	
Schlesinger v. Reservists Committee to Stop the War 418 u.s. 208 (1974)	Armed Services	
Schick v. Reed 419 u.s. 256 (1974)	Armed Services	
Rostker v. Goldberg 453 u.s. 57 (1981)	Armed Services	
United States v. Lovett 328 u.s. 303 (1946)	Attainder	
American Communications Assn. v. Douds 339 u.s. 382 (1950)	Attainder	
Barenblatt v. United States 360 u.s. 109 (1959)	Attainder	
Communist Party of the United States v. Subversive Activities Control Bd. No. 12 367 u.s. 1 (1961)	Attainder	
Aptheker v. Secretary of State 378 u.s. 500 (1964)	Attainder	
United States v. Brown 381 u.s. 437 (1965)	Attainder	
Nixon v. Administrator of General Services 433 u.s. 425 (1977)	Attainder	
Ex Parte Garland 71 u.s. 333 (1866)	Attorneys	
In re Primus 436 u.s. 412 (1978)	Attorneys	
Butz v. Economou 438 u.s. 478 (1978)	Attorneys	
Supreme Court of New Hampshire v. Piper 470 u.s. 274 (1985)	Attorneys	
Nix v. Whiteside 475 u.s. 157 (1986)	Attorneys	
Phillips v. Washington Legal Foundation 521 u.s. 117 (1998)	Attorneys	
Northern Pipeline Constr. Co. v. Marathon Pipe Line Co. 458 u.s. 50 (1982)	Bankruptcy	
Barron v. Mayor & City Council of Baltimore 32 u.s. 243 (1833)	Bill of Rights	
Buck v. Bell 274 u.s. 200 (1927)	Contraception	
Griswold v. Connecticut 381 u.s. 479 (1965)	Contraception	
Carey v. Population Services International 431 u.s. 678 (1977)	Contraception	
Bolger v. Youngs Drugs Prods. Corp. 463 u.s. 60 (1983)	Contraception	
Foster & Elam v. Neilson 27 u.s. 253 (1829)	Borders	
Palko v. Connecticut 302 u.s. 319 (1937)	Capital Punishment	
Louisiana ex rel. Francis v. Resweber 329 u.s. 459 (1947)	Capital Punishment	
United States v. Jackson 390 u.s. 570 (1968)	Capital Punishment	
Witherspoon v. Illinois 391 u.s. 510 (1968)	Capital Punishment	
Bumper v. North Carolina 391 u.s. 543 (1968)	Capital Punishment	
Furman v. Georgia 408 u.s. 238 (1972)	Capital Punishment	
Schick v. Reed 419 u.s. 256 (1974)	Capital Punishment	
Gregg v. Georgia 428 u.s. 153 (1976)	Capital Punishment	
Proffitt v. Florida 428 u.s. 242 (1976)	Capital Punishment	
Jurek v. Texas 428 u.s. 262 (1976)	Capital Punishment	
Woodson v. North Carolina 428 u.s. 280 (1976)	Capital Punishment	
Coker v. Georgia 433 u.s. 584 (1977)	Capital Punishment	
Lockett v. Ohio 438 u.s. 586 (1978)	Capital Punishment	
Bell v. Ohio 438 u.s. 637 (1978)	Capital Punishment	
Eddings v. Oklahoma 455 u.s. 104 (1982)	Capital Punishment	
Enmund v. Florida 458 u.s. 782 (1982)	Capital Punishment	
Pulley v. Harris 465 u.s. 37 (1984)	Capital Punishment	
Lockhart v. McCree 476 u.s. 162 (1986)	Capital Punishment	
Ford v. Wainwright 477 u.s. 399 (1986)	Capital Punishment	
McCleskey v. Kemp 481 u.s. 279 (1987)	Capital Punishment	
Booth v. Maryland 482 u.s. 496 (1987)	Capital Punishment	
Thompson v. Oklahoma 487 u.s. 815 (1988)	Capital Punishment	
South Carolina v. Gathers 490 u.s. 805 (1989)	Capital Punishment	
Penry v. Lynaugh 492 u.s. 302 (1989)	Capital Punishment	
Stanford v. Kentucky 492 u.s. 361 (1989)	Capital Punishment	
Dawson v. Delaware 503 u.s. 159 (1992)	Capital Punishment	
Gomez v. United States District Court for the Northern District of California 503 u.s. 653 (1992)	Capital Punishment	
Atkins v. Virginia 00-8452 (2002)	Capital Punishment	
Near v. Minnesota 283 u.s. 697 (1931)	Censorship	
Erznoznik v. City of Jacksonville 422 u.s. 205 (1975)	Censorship	
Ashcroft v. Free Speech Coalition 00-795 (2002)	Censorship	
Hammer v. Dagenhart 247 u.s. 251 (1918)	Children	
Bailey v. Drexel Furniture Company 259 u.s. 20 (1922)	Children	
Meyer v. State of Nebraska 262 u.s. 390 (1923)	Children	
Pierce v. Society of Sisters 268 u.s. 510 (1925)	Children	
Minersville School District v. Board of Education 310 u.s. 586 (1940)	Children	
West Virginia State Board of Education v. Barnette 319 u.s. 624 (1943)	Children	
Prince v. Massachusetts 321 u.s. 158 (1944)	Children	
Everson v. Board of Education of the Township of Ewing 330 u.s. 1 (1947)	Children	
In re Gault 387 u.s. 1 (1967)	Children	
Tinker v. Des Moines Independent Community School Dist. 393 u.s. 503 (1969)	Children	
Ingraham v. Wright 430 u.s. 651 (1977)	Children	
Santosky v. Kramer 455 u.s. 745 (1982)	Children	
Palmore v. Sidoti 466 u.s. 429 (1984)	Children	
Hazelwood School Dist. v. Kuhlmeier 484 u.s. 260 (1988)	Children	
DeShaney v. Winnebago County Department of Social Services 489 u.s. 189 (1989)	Children	
Massachusetts v. Oakes 491 u.s. 576 (1989)	Children	
Osborne v. Ohio 495 u.s. 103 (1990)	Children	
Maryland v. Craig 497 u.s. 836 (1990)	Children	
United States v. Lopez 514 u.s. 549 (1995)	Children	
Troxel v. Granville 530 u.s. 57 (2000)	Children	
Ashcroft v. Free Speech Coalition 00-795 (2002)	Children	
Nguyen v. INS 99-2071 (2001)	Children	
Swift v. Tyson 41 u.s. 1 (1842)	Choice of Law	
Erie Railroad Co. v. Tompkins 304 u.s. 64 (1938)	Choice of Law	
Ex Parte Quirin 317 u.s. 1 (1942)	Choice of Law	
Smith v. Allwright 321 u.s. 649 (1944)	Choice of Law	
Evans v. Newton 382 u.s. 296 (1966)	Choice of Law	
Arizona v. Fulminante 499 u.s. 279 (1991)	Choice of Law	
Talbot v. Janson 3 u.s. 133 (1795)	Citizenship	
Ableman v. Booth 62 u.s. 506 (1858)	Citizenship	
Minor v. Happersett 88 u.s. 162 (1875)	Citizenship	
United States v. Wong Kim Ark 169 u.s. 649 (1898)	Citizenship	
Twining v. State 211 u.s. 78 (1908)	Citizenship	
Hague v. Committee for Industrial Organization 307 u.s. 496 (1939)	Citizenship	
Perez v. Brownell 356 u.s. 44 (1958)	Citizenship	
Trop v. Dulles 356 u.s. 86 (1958)	Citizenship	
Schneider v. Rusk 377 u.s. 163 (1964)	Citizenship	
Afroyim v. Rusk 387 u.s. 253 (1967)	Citizenship	
Graham v. Department of Pub. Welfare 403 u.s. 365 (1971)	Citizenship	
Hampton v. Mow Sun Wong 426 u.s. 88 (1976)	Citizenship	
Ambach v. Norwick 441 u.s. 68 (1979)	Citizenship	
Building Trades & Construction Trades Council of Camden County and Vicinity v. Mayor and Council of the City of Camden 465 u.s. 208 (1984)	Citizenship	
Nguyen v. INS 99-2071 (2001)	Citizenship	
Ex Parte Quirin 317 u.s. 1 (1942)	Commander in Chief	
Korematsu v. United States 323 u.s. 214 (1944)	Commander in Chief	
Woods v. Cloyd W. Miller Co. 333 u.s. 138 (1948)	Commander in Chief	
United States v. Quarles 350 u.s. 11 (1955)	Commander in Chief	
Reid v. Covert 354 u.s. 1 (1957)	Commander in Chief	
Gibbons v. Ogden 22 u.s. 1 (1824)	Commerce Clause	
Willson v. Black Bird Creek Marsh Company 27 u.s. 245 (1829)	Commerce Clause	
Cooley v. Board of Wardens 53 u.s. 299 (1851)	Commerce Clause	
Slaughterhouse Cases 83 u.s. 36 (1872)	Commerce Clause	
United States v. E. C. Knight Company 156 u.s. 1 (1895)	Commerce Clause	
In re Debs 158 u.s. 564 (1895)	Commerce Clause	
Northern Securities Co. v. United States 193 u.s. 197 (1904)	Commerce Clause	
Swift and Company v. United States 196 u.s. 375 (1905)	Commerce Clause	
Adair v. United States 208 u.s. 161 (1908)	Commerce Clause	
Loewe v. Lawlor 208 u.s. 274 (1908)	Commerce Clause	
Standard Oil Co. of New Jersey v. United States 221 u.s. 1 (1911)	Commerce Clause	
Houston East and West Texas Railway Company v. United States 234 u.s. 342 (1914)	Commerce Clause	
Wilson v. New 243 u.s. 332 (1917)	Commerce Clause	
Hammer v. Dagenhart 247 u.s. 251 (1918)	Commerce Clause	
Adkins v. Children's Hospital 261 u.s. 525 (1923)	Commerce Clause	
"Baldwin v. G.A.F. Seelig, Inc. 294 u.s. 511 (1935)"	Commerce Clause	
A. L. A. Schechter Poultry Corp. v. United States 295 u.s. 495 (1935)	Commerce Clause	
Carter v. Carter Coal Co. 298 u.s. 238 (1936)	Commerce Clause	
National Labor Relations Board v. Jones & Laughlin Steel Corp. 301 u.s. 1 (1937)	Commerce Clause	
"South Carolina State Highway Department v. Barnwell Brothers, Inc. 303 u.s. 177 (1938)"	Commerce Clause	
United States v. Carolene Products Co. 304 u.s. 144 (1938)	Commerce Clause	
Mulford v. Smith 307 u.s. 38 (1939)	Commerce Clause	
United States v. Darby 312 u.s. 100 (1941)	Commerce Clause	
Wickard v. Filburn 317 u.s. 111 (1942)	Commerce Clause	
Southern Pacific Co. v. Arizona 325 u.s. 761 (1945)	Commerce Clause	
American Communications Assn. v. Douds 339 u.s. 382 (1950)	Commerce Clause	
Dean Milk Co. v. City of Madison 340 u.s. 349 (1951)	Commerce Clause	
"Bibb v. Navajo Freight Lines, Inc. 359 u.s. 520 (1959)"	Commerce Clause	
Huron Portland Cement Co. v. City of Detroit 362 u.s. 440 (1960)	Commerce Clause	
"Heart of Atlanta Motel, Inc. v. United States 379 u.s. 241 (1964)"	Commerce Clause	
Katzenbach v. McClung 379 u.s. 294 (1964)	Commerce Clause	
United States v. Brown 381 u.s. 437 (1965)	Commerce Clause	
National League of Cities v. Usery 426 u.s. 833 (1976)	Commerce Clause	
United States Trust Company of New York v. New Jersey 431 u.s. 1 (1977)	Commerce Clause	
Hunt v. Washington State Apple Advertising Commission 432 u.s. 333 (1977)	Commerce Clause	
City of Philadelphia v. New Jersey 437 u.s. 617 (1978)	Commerce Clause	
Fullilove v. Klutznick 448 u.s. 448 (1980)	Commerce Clause	
Minnesota v. Clover Leaf Creamery Co. 449 u.s. 456 (1981)	Commerce Clause	
Kassel v. Consolidated Freightways Corporation of Delaware 450 u.s. 662 (1981)	Commerce Clause	
Building Trades & Construction Trades Council of Camden County and Vicinity v. Mayor and Council of the City of Camden 465 u.s. 208 (1984)	Commerce Clause	
Garcia v. San Antonio Transit Authority 469 u.s. 528 (1985)	Commerce Clause	
Quill Corp. v. North Dakota by and Through Heitkamp 504 u.s. 298 (1992)	Commerce Clause	
"C & A Carbone, Inc. v. Town of Clarkstown 511 u.s. 383 (1994)"	Commerce Clause	
United States v. Lopez 514 u.s. 549 (1995)	Commerce Clause	
Reno v. Condon 528 u.s. 141 (2000)	Commerce Clause	
United States v. Morrison 529 u.s. 598 (2000)	Commerce Clause	
"Grosjean v. American Press Co., Inc. 297 u.s. 233 (1936)"	Commercial Speech	
Roth v. United States 354 u.s. 476 (1957)	Commercial Speech	
New York Times Co. v. Sullivan 376 u.s. 254 (1964)	Commercial Speech	
Bates v. State Bar of Arizona 433 u.s. 350 (1977)	Commercial Speech	
Central Hudson Gas & Elec. Corp. v. Public Service Comm'n 447 u.s. 557 (1980)	Commercial Speech	
Bolger v. Youngs Drugs Prods. Corp. 463 u.s. 60 (1983)	Commercial Speech	
"Kalman J. BERENYI, Petitioner, v. DISTRICT DIRECTOR, IMMIGRATION AND NATURALIZATION SERVICE."	Communism	Page 1
W. E. B. DuBOIS CLUBS OF AMERICA et al. v. CLARK et al.	Communism	Page 1
"Charles ROWOLDT, Petitioner, v. J. D. PERFETTO, Acting Officer in Charge, Immigration and Naturalization Service, Department of Justice, St. Paul, Minnesota."	Communism	Page 1
"Willia NIUKKANEN, etc., Petitioner, v. E. D. McALEXANDER, etc."	Communism	Page 1
Barenblatt v. United States	Communism	Page 1
"Stanislaw NOWAK, Petitioner, v. UNITED STATES of America."	Communism	Page 1
Bond v. Floyd	Communism	Page 1
DENNIS v. UNITED STATES.	Communism	Page 1
SCHNEIDERMAN v. UNITED STATES.	Communism	Page 1
TERMINIELLO v. CITY OF CHICAGO.	Communism	Page 1
"Hugo DeGREGORY, Appellant, v. ATTORNEY GENERAL OF the STATE OF NEW HAMPSHIRE."	Communism	Page 2
"Mabel BLACK and T. Y. Wulff et al., Petitioners, v. CUTTER LABORATORIES, a Corporation."	Communism	Page 2
"John Francis NOTO, Petitioner, v. UNITED STATES."	Communism	Page 2
"Willard UPHAUS, Appellant, v. Louis C. WYMAN, Attorney General, State of New Hampshire."	Communism	Page 2
"Bernhard DEUTCH, Petitioner, v. UNITED STATES."	Communism	Page 2
Dennis v. United States	Communism	Page 2
Watkins v. United States	Communism	Page 2
"HERNDON v. LOWRY, Sheriff."	Communism	Page 2
Whitney v. California	Communism	Page 2
"Carl BRADEN, Petitioner, v. UNITED STATES."	Communism	Page 2
"Theodore R. GIBSON, Petitioner, v. FLORIDA LEGISLATIVE INVESTIGATION COMMITTEE."	Communism	Page 3
"Jose Maria GASTELUM-QUINONES, Petitioner, v. Robert F. KENNEDY, Attorney General of the United States (two cases)."	Communism	Page 3
"Rudolph SCHWARE, Petitioner, v. BOARD OF BAR EXAMINERS OF THE STATE OF NEW MEXICO."	Communism	Page 3
"Herbert SCHNEIDER, Appellant, v. Willard SMITH, Commandant, United States Coast Guard."	Communism	Page 3
"AMERICAN COMMITTEE FOR PROTECTION OF FOREIGN BORN, Petitioner, v. SUBVERSIVE ACTIVITIES CONTROL BOARD."	Communism	Page 3
"Sara BAIRD, Petitioner, v. STATE BAR OF ARIZONA."	Communism	Page 3
"Otho G. BELL et al., Petitioners, v. UNITED STATES."	Communism	Page 3
"Brian V. HUNTER and Jeffrey Jordan v. James V. BRYANT, Jr."	Communism	Page 3
"Frank BONETTI, Petitioner, v. William P. ROGERS, Attorney General of the United States, et al."	Communism	Page 3
GALVAN v. PRESS.	Communism	Page 4
HARTZEL v. UNITED STATES.	Communism	Page 4
"Paul M. SWEEZY, Appellant, v. STATE OF NEW HAMPSHIRE by Louis C. WYMAN, Attorney General."	Communism	Page 4
"Julius EMSPAK, Petitioner, v. UNITED STATES of America."	Communism	Page 4
Yates v. United States	Communism	Page 4
"Frank DYSON, Chief of Police, City of Dallas, et al., Appellants, v. Brent STEIN."	Communism	Page 4
"RAILWAY EMPLOYES' DEPARTMENT, American Federation of Labor, International Association of Machinists, et al., Appellants, v. Robert L. HANSON, Horace A. Cameron, Harold J. Grau, et al."	Communism	Page 4
"COMMUNIST PARTY OF THE UNITED STATES of America, Petitioner, v. SUBVERSIVE ACTIVITIES CONTROL BOARD."	Communism	Page 4
NotFound v. The BOARD OF HIGHER EDUCATION OF The CITY OF NEW YORK.	Communism	Page 4
Slochower v. Board of Higher Education of New York City	Communism	Page 4
"CAFETERIA AND RESTAURANT WORKERS UNION, LOCAL 473, AFL-CIO, et al., Petitioners, v. Neil H. McELROY et al."	Communism	Page 5
Clark v. Community for Creative Nonviolence	Communism	Page 5
Board of Education v. Allen	Communism	Page 5
Kent v. Dulles	Communism	Page 5
Scales v. United States	Communism	Page 5
Pennsylvania v. Nelson	Communism	Page 5
"SHAUGHNESSY, District Director of Immigration and Naturalization, v. UNITED STATES ex rel. MEZEI."	Communism	Page 5
Gitlow v. People	Communism	Page 5
"Raphael KONIGSBERG, Petitioner, v. The STATE BAR OF CALIFORNIA and the Committee of Bar Examiners of the State Barof California."	Communism	Page 5
Communist Party of the United States v. Subversive Activities Control Bd. No. 12	Communism	Page 5
"Richard L. THORNBURGH, Attorney General of the United States, et al., Petitioners v. Jack ABBOTT, et al."	Communism	Page 6
"Oswald ZSCHERNIG et al., Appellants, v. William J. MILLER, Administrator et al."	Communism	Page 6
Aptheker v. Secretary of State	Communism	Page 6
"FLEMMING, Secretary of Health, Education, and Welfare, Appellant, v. Ephram NESTOR."	Communism	Page 6
Perez v. Brownell	Communism	Page 6
"Thomas QUINN, Petitioner, v. UNITED STATES of America."	Communism	Page 6
KEDROFF et al. v. ST. NICHOLAS CATHEDRAL OF RUSSIAN ORTHODOX CHURCH IN NORTH AMERICA.	Communism	Page 6
"POINDEXTER v. GREENHOW, Treasurer, etc."	Communism	Page 6
KERRY v. DIN	Communism	Page 6
Rust v. Sullivan	Communism	Page 6
United States v. United States District Court	Communism	Page 7
"CARLSON et al. v. LANDON, District Director of Immigration & Naturalization, United States Department of Justice. BUTTERFIELD, Director of Immigration & Naturalization Service, Detroit, Mich. v. ZYDOK."	Communism	Page 7
"BRIDGES v. WIXON, District Director, Immigration and Naturalization Service."	Communism	Page 7
"Raphael KONIGSBERG, Petitioner, v. STATE BAR OF CALIFORNIA and the Committee of Bar Examiners of the State of California."	Communism	Page 7
Skinner v. Railway Labor Executives' Association	Communism	Page 7
"School District of Abington Township, Pennsylvania v. Schempp"	Communism	Page 7
Chambers v. Florida 309 u.s. 227 (1940)	Confessions	
Mallory v. United States 354 u.s. 449 (1957)	Confessions	
Massiah v. United States 377 u.s. 201 (1964)	Confessions	
Erie Railroad Co. v. Tompkins 304 u.s. 64 (1938)	Conflict of Laws	
United States v. Pink 315 u.s. 203 (1942)	Conflict of Laws	
Ex parte McCardle 74 u.s. 506 (1868)	Congress	
United States v. Klein 80 u.s. 128 (1871)	Congress	
Kilbourn v. Thompson 103 u.s. 168 (1880)	Congress	
Coyle v. Smith 221 u.s. 559 (1911)	Congress	
Bailey v. Drexel Furniture Company 259 u.s. 20 (1922)	Congress	
The Pocket Veto Case 279 u.s. 655 (1929)	Congress	
A. L. A. Schechter Poultry Corp. v. United States 295 u.s. 495 (1935)	Congress	
Humphrey's Executor v. United States 295 u.s. 602 (1935)	Congress	
Ashwander v. Tennessee Valley Authority 297 u.s. 288 (1936)	Congress	
United States v. Belmont 301 u.s. 324 (1937)	Congress	
Helvering v. Davis 301 u.s. 619 (1937)	Congress	
Mulford v. Smith 307 u.s. 38 (1939)	Congress	
United States v. Darby 312 u.s. 100 (1941)	Congress	
Colegrove v. Green 328 u.s. 549 (1946)	Congress	
Watkins v. United States 354 u.s. 178 (1957)	Congress	
Barenblatt v. United States 360 u.s. 109 (1959)	Congress	
Glidden Co. v. Zdanok 370 u.s. 530 (1962)	Congress	
Bond v. Floyd 385 u.s. 116 (1966)	Congress	
Powell v. McCormack 395 u.s. 486 (1969)	Congress	
United States v. Brewster 408 u.s. 501 (1972)	Congress	
Gravel v. United States 408 u.s. 606 (1972)	Congress	
Doe v. McMillan 412 u.s. 306 (1973)	Congress	
Schlesinger v. Reservists Committee to Stop the War 418 u.s. 208 (1974)	Congress	
Train v. City of New York 420 u.s. 35 (1975)	Congress	
Buckley v. Valeo 424 u.s. 1 (1976)	Congress	
City of Philadelphia v. New Jersey 437 u.s. 617 (1978)	Congress	
Hutchinson v. Proxmire 443 u.s. 111 (1979)	Congress	
United States. Railroad Retirement Board v. Fritz 449 u.s. 166 (1980)	Congress	
Bowsher v. Synar 478 u.s. 714 (1986)	Congress	
Printz v. United States 521 u.s. 898 (1997)	Congress	
Clinton v. City of New York 524 u.s. 417 (1998)	Congress	
Department of Commerce v. United States House 525 u.s. 326 (1999)	Congress	
Fletcher v. Peck 10 u.s. 87 (1810)	Contract Clause	
Trustees of Dartmouth College v. Woodward 17 u.s. 518 (1819)	Contract Clause	
Gibbons v. Ogden 22 u.s. 1 (1824)	Contract Clause	
Proprietors of Charles River Bridge v. Proprietors of Warren Bridge 36 u.s. 420 (1837)	Contract Clause	
Holden v. Hardy 169 u.s. 366 (1898)	Contract Clause	
Lochner v. New York 198 u.s. 45 (1905)	Contract Clause	
Home Building & Loan Assn. v. Blaisdell 290 u.s. 398 (1934)	Contract Clause	
Allied Structural Steel Co. v. Spannaus 438 u.s. 234 (1978)	Contract Clause	
Patton v. United States 281 u.s. 276 (1930)	Courts	
Cohens v. Virginia 19 u.s. 264 (1821)	Criminal	
Ableman v. Booth 62 u.s. 506 (1858)	Criminal	
Kentucky v. Dennison 65 u.s. 66 (1860)	Criminal	
Ex parte Milligan 71 u.s. 2 (1866)	Criminal	
Munn v. Illinois 94 u.s. 113 (1876)	Criminal	
Strauder v. West Virginia 100 u.s. 303 (1879)	Criminal	
Ex parte Siebold 100 u.s. 371 (1879)	Criminal	
Hurtado v. California 110 u.s. 516 (1884)	Criminal	
In re Neagle 135 u.s. 1 (1890)	Criminal	
In re Debs 158 u.s. 564 (1895)	Criminal	
Maxwell v. Dow 176 u.s. 581 (1900)	Criminal	
Northern Securities Co. v. United States 193 u.s. 197 (1904)	Criminal	
Adair v. United States 208 u.s. 161 (1908)	Criminal	
Twining v. State 211 u.s. 78 (1908)	Criminal	
Truax v. Raich 239 u.s. 33 (1915)	Criminal	
Abrams v. United States 250 u.s. 616 (1919)	Criminal	
Meyer v. State of Nebraska 262 u.s. 390 (1923)	Criminal	
Ex Parte Grossman 267 u.s. 87 (1925)	Criminal	
Gitlow v. People 268 u.s. 652 (1925)	Criminal	
Patton v. United States 281 u.s. 276 (1930)	Criminal	
Powell v. Alabama 287 u.s. 45 (1932)	Criminal	
Norris v. Alabama 294 u.s. 587 (1935)	Criminal	
De Jonge v. Oregon 299 u.s. 353 (1937)	Criminal	
Palko v. Connecticut 302 u.s. 319 (1937)	Criminal	
United States v. Carolene Products Co. 304 u.s. 144 (1938)	Criminal	
Johnson v. Zerbst 304 u.s. 458 (1938)	Criminal	
United States v. Miller 307 u.s. 174 (1939)	Criminal	
Chambers v. Florida 309 u.s. 227 (1940)	Criminal	
Thornhill v. Alabama 310 u.s. 88 (1940)	Criminal	
Cantwell v. Connecticut 310 u.s. 296 (1940)	Criminal	
United States v. Darby 312 u.s. 100 (1941)	Criminal	
Chaplinsky v. New Hampshire 315 u.s. 568 (1942)	Criminal	
Skinner v. Oklahoma ex rel. Williamson 316 u.s. 535 (1942)	Criminal	
Ex Parte Quirin 317 u.s. 1 (1942)	Criminal	
Pollock v. Williams 322 u.s. 4 (1944)	Criminal	
Korematsu v. United States 323 u.s. 214 (1944)	Criminal	
Marsh v. Alabama 326 u.s. 501 (1946)	Criminal	
Morgan v. Virginia 328 u.s. 373 (1946)	Criminal	
Louisiana ex rel. Francis v. Resweber 329 u.s. 459 (1947)	Criminal	
Adamson v. California 332 u.s. 46 (1947)	Criminal	
Dennis v. United States 341 u.s. 494 (1951)	Criminal	
United States v. Quarles 350 u.s. 11 (1955)	Criminal	
Ullmann v. United States 350 u.s. 422 (1956)	Criminal	
Pennsylvania v. Nelson 350 u.s. 497 (1956)	Criminal	
Reid v. Covert 354 u.s. 1 (1957)	Criminal	
Watkins v. United States 354 u.s. 178 (1957)	Criminal	
Yates v. United States 354 u.s. 298 (1957)	Criminal	
Mallory v. United States 354 u.s. 449 (1957)	Criminal	
Roth v. United States 354 u.s. 476 (1957)	Criminal	
Bartkus v. Illinois 359 u.s. 121 (1959)	Criminal	
Barenblatt v. United States 360 u.s. 109 (1959)	Criminal	
Huron Portland Cement Co. v. City of Detroit 362 u.s. 440 (1960)	Criminal	
Scales v. United States 367 u.s. 203 (1961)	Criminal	
Mapp v. Ohio 367 u.s. 643 (1961)	Criminal	
Hoyt v. Florida 368 u.s. 57 (1961)	Criminal	
Robinson v. California 370 u.s. 660 (1962)	Criminal	
Gideon v. Wainwright 372 u.s. 335 (1963)	Criminal	
Malloy v. Hogan 378 u.s. 1 (1964)	Criminal	
Jacobellis v. Ohio 378 u.s. 184 (1964)	Criminal	
Escobedo v. Illinois 378 u.s. 478 (1964)	Criminal	
Cox v. Louisiana 379 u.s. 559 (1965)	Criminal	
Pointer v. Texas 380 u.s. 400 (1965)	Criminal	
United States v. Brown 381 u.s. 437 (1965)	Criminal	
Griswold v. Connecticut 381 u.s. 479 (1965)	Criminal	
United States v. Guest 383 u.s. 745 (1966)	Criminal	
Miranda v. Arizona 384 u.s. 436 (1966)	Criminal	
In re Gault 387 u.s. 1 (1967)	Criminal	
Warden v. Hayden 387 u.s. 294 (1967)	Criminal	
Loving v. Virginia 388 u.s. 1 (1967)	Criminal	
Berger v. New York 388 u.s. 41 (1967)	Criminal	
Katz v. United States 389 u.s. 347 (1967)	Criminal	
Duncan v. Louisiana 391 u.s. 145 (1968)	Criminal	
United States v. O'Brien 391 u.s. 367 (1968)	Criminal	
Witherspoon v. Illinois 391 u.s. 510 (1968)	Criminal	
Terry v. Ohio 392 u.s. 1 (1968)	Criminal	
Stanley v. Georgia 394 u.s. 557 (1969)	Criminal	
Street v. New York 394 u.s. 576 (1969)	Criminal	
Brandenburg v. Ohio 395 u.s. 444 (1969)	Criminal	
Benton v. Maryland 395 u.s. 784 (1969)	Criminal	
In re Winship 397 u.s. 358 (1970)	Criminal	
Waller v. Florida 397 u.s. 387 (1970)	Criminal	
Ashe v. Swenson 397 u.s. 436 (1970)	Criminal	
Welsh v. United States 398 u.s. 333 (1970)	Criminal	
Chambers v. Maroney 399 u.s. 42 (1970)	Criminal	
Williams v. Florida 399 u.s. 78 (1970)	Criminal	
Younger v. Harris 401 u.s. 37 (1971)	Criminal	
Harris v. New York 401 u.s. 222 (1971)	Criminal	
Cohen v. California 403 u.s. 15 (1971)	Criminal	
Apodaca v. Oregon 406 u.s. 404 (1972)	Criminal	
Argersinger v. Hamlin 407 u.s. 25 (1972)	Criminal	
Adams v. Williams 407 u.s. 143 (1972)	Criminal	
United States v. United States District Court 407 u.s. 297 (1972)	Criminal	
Furman v. Georgia 408 u.s. 238 (1972)	Criminal	
United States v. Brewster 408 u.s. 501 (1972)	Criminal	
Roe v. Wade 410 u.s. 113 (1973)	Criminal	
Schneckloth v. Bustamonte 412 u.s. 218 (1973)	Criminal	
Miller v. California 413 u.s. 15 (1973)	Criminal	
Paris Adult Theatre I v. Slaton 413 u.s. 49 (1973)	Criminal	
United States v. Calandra 414 u.s. 338 (1974)	Criminal	
United States v. Kahn 415 u.s. 143 (1974)	Criminal	
